inputs,target
context : i enjoy exercising. @ path_tailentity : parent,enjoy love go  school  school drop kid  drop kid parent
context : i enjoy exercising. @ path_tailentity : kid,enjoy  work  need  work  pregnancy  love  kid
context : i enjoy exercising. @ path_tailentity : kid,enjoy  work  need  work  pregnancy  love  kid
context : i enjoy exercising. @ path_tailentity : kid,enjoy  love  work  need  work  pregnancy  kid
context : i enjoy exercising. @ path_tailentity : kid,enjoy  work  work  passion  need work  kid
context : i enjoy exercising. @ path_tailentity : kid,exercise  work  need  work  pregnancy  love  kid
context : i enjoy exercising. @ path_tailentity : parent,enjoy  work  need work  pregnancy  love  parent
context : i enjoy exercising. @ path_tailentity : parent,enjoy  work  passion  work  work  need parent
context : i enjoy exercising. @ path_tailentity : parent,enjoy  love  work  pregnancy  work  need parent
context : i am going to school to earn a degree. @ path_tailentity : consume,earn degree dietician  consume
context : i am going to school to earn a degree. @ path_tailentity : consume,earn dietician  consume
context : i am going to school to earn a degree. @ path_tailentity : consume,degree  dietician  consume
context : i am going to school to earn a degree. @ path_tailentity : consume,earn degree  learn  college  value  consume
context : i am going to school to earn a degree. @ path_tailentity : consume,earn college  learn  value  consume
context : i am going to school to earn a degree. @ path_tailentity : consume,degree  college  learn  value  consume
context : i am going to school to earn a degree. @ path_tailentity : consume,degree  college  learn  value  consume
context : i am going to school to earn a degree. @ path_tailentity : consume,degree  afford buying  providing  income  go way  vegan product  consume
context : i found my spouse at a musical performance by a boy band. @ path_tailentity : sister,found spouse  brother  sister
context : i found my spouse at a musical performance by a boy band. @ path_tailentity : sister,spouse  sister
context : i found my spouse at a musical performance by a boy band. @ path_tailentity : sister,found spouse  current husband  former husband  have sibling  met  sister
context : i found my spouse at a musical performance by a boy band. @ path_tailentity : sister,found spouse  current husband  married person  have sibling  met  sister
context : i found my spouse at a musical performance by a boy band. @ path_tailentity : sister,spouse  have sibling  person  current husband  met  sister
context : i found my spouse at a musical performance by a boy band. @ path_tailentity : sister,spouse  own sibling  person  current husband  met  sister
context : i found my spouse at a musical performance by a boy band. @ path_tailentity : sister,found spouse  relative  relationship  sister
context : i found my spouse at a musical performance by a boy band. @ path_tailentity : sister,found spouse  sibling  relationship  sister
context : i found my spouse at a musical performance by a boy band. @ path_tailentity : sister,found spouse  brother  relationship  sister
context : i found my spouse at a musical performance by a boy band. @ path_tailentity : sister,spouse  sibling  relationship  sister
context : i found my spouse at a musical performance by a boy band. @ path_tailentity : sister,spouse  sibling relationship  relationship  sister
context : i found my spouse at a musical performance by a boy band. @ path_tailentity : sister,spouse  family  relationship  sister
context : i found my spouse at a musical performance by a boy band. @ path_tailentity : have brother,found spouse  sibling  relationship  have brother
context : i found my spouse at a musical performance by a boy band. @ path_tailentity : have brother,found spouse  sibling relationship  relationship  have brother
context : i enjoy spending time in the water. @ path_tailentity : tear,spending time  enjoying opera  enjoy music spare time person  swim sport  tear
context : i enjoy spending time in the water. @ path_tailentity : tear,spending time  spare time person  enjoy opera  enjoy music  swim sport  tear
context : i enjoy spending time in the water. @ path_tailentity : move tear,spending  spending time  enjoying opera  enjoy music spare time person  move tear
context : i enjoy spending time in the water. @ path_tailentity : move tear,spending  spare time person  enjoy opera  enjoy opera  swim sport  move tear
context : i enjoy spending time in the water. @ path_tailentity : tear,spending time  water park  singer occupation tear
context : i enjoy spending time in the water. @ path_tailentity : move tear,spending time  pool party  good song  bring tear  music  move tear
context : i enjoy spending time in the water. @ path_tailentity : tear,spending time  pool party  good song  bring tear  music  tear
context : i enjoy spending time in the water. @ path_tailentity : move tear,spending  pool party  good song  bring tear  music  move tear
context : i talk to a mental health professional but i do not think she gets me. @ path_tailentity : parent,mental health professional  suffer  sibling envy  parent
context : i talk to a mental health professional but i do not think she gets me. @ path_tailentity : parent,mental health professional  counselor envy  suffer parent
context : i talk to a mental health professional but i do not think she gets me. @ path_tailentity : parent,professional  sibling envy  suffer parent
context : i talk to a mental health professional but i do not think she gets me. @ path_tailentity : parent,mental  sibling envy  suffer parent
context : i talk to a mental health professional but i do not think she gets me. @ path_tailentity : parent,mental health professional  have person  have problem  parent
context : i talk to a mental health professional but i do not think she gets me. @ path_tailentity : parent,professional  have problem  have person parent
context : i talk to a mental health professional but i do not think she gets me. @ path_tailentity : parent,mental  have problem  have person parent
context : i talk to a mental health professional but i do not think she gets me. @ path_tailentity : parent,mental health professional  attention  get paid  big family  parent
context : i talk to a mental health professional but i do not think she gets me. @ path_tailentity : parent,professional  attention  get paid  big family  parent
context : i talk to a mental health professional but i do not think she gets me. @ path_tailentity : parent,mental  big family  get paid  attention  parent
context : i talk to a mental health professional but i do not think she gets me. @ path_tailentity : parent,mental  attention  get paid  big family  parent
context : i am a well educated businessman. @ path_tailentity : boyfriend,educate businessman  spend time work person  boyfriend
context : i am a well educated businessman. @ path_tailentity : boyfriend,businessman  work person  spend time  boyfriend
context : i am a well educated businessman. @ path_tailentity : boyfriend,educate  work person  spend time  boyfriend
context : i am a well educated businessman. @ path_tailentity : boyfriend,businessman  never graduate  never graduate  college  be inventor  boyfriend
context : i am a well educated businessman. @ path_tailentity : boyfriend,educate  college  never graduate  be inventor  be inventor boyfriend
context : i am a well educated businessman. @ path_tailentity : boyfriend,businessman  business executive _occupation boyfriend
context : i am a well educated businessman. @ path_tailentity : boyfriend,educate  business executive  boyfriend
context : i am a well educated businessman. @ path_tailentity : boyfriend,educate businessman so be  boyfriend
context : i am a well educated businessman. @ path_tailentity : boyfriend,educate so be  boyfriend
context : i am a well educated businessman. @ path_tailentity : boyfriend,educate businessman  study  met boyfriend month  boyfriend
context : i am a well educated businessman. @ path_tailentity : boyfriend,educate businessman  study  met boyfriend  study  boyfriend
context : i am a well educated businessman. @ path_tailentity : boyfriend,educate businessman  study  met boyfriend  study  boyfriend
context : i am a well educated businessman. @ path_tailentity : boyfriend,businessman  study  met boyfriend  boyfriend
context : i am a well educated businessman. @ path_tailentity : boyfriend,businessman  study  met boyfriend  boyfriend
context : i am a well educated businessman. @ path_tailentity : boyfriend,educate  study  meet boyfriend  boyfriend
context : i am a well educated businessman. @ path_tailentity : boyfriend,educate  study  met boyfriend boyfriend
context : i am a well educated businessman. @ path_tailentity : boyfriend,educate  study  met boyfriend  boyfriend
context : i love art museums. @ path_tailentity : lease car,art museum  car payment  save  own art collection  start  start  lease car
context : i love art museums. @ path_tailentity : lease,art museum  car payment  save  own art collection  start  start lease
context : i love art museums. @ path_tailentity : lease car,museum  own art collection  save  be save  own art  car payment  lease car
context : i love art museums. @ path_tailentity : lease car,museum  own art collection  save  save  car payment  start lease car
context : i love art museums. @ path_tailentity : lease car,museum  own art collection  save  car payment  start  start  lease car
context : i love art museums. @ path_tailentity : lease car,art museum  go museum  not afford  lease car
context : i love art museums. @ path_tailentity : lease,art museum  not afford  go museum lease
context : i love art museums. @ path_tailentity : lease car,museum  not afford  go museum  lease car
context : i have a very strong body. @ path_tailentity : hunt deer,strong body  strength  go hunt  take muscle  hunt deer
context : i have a very strong body. @ path_tailentity : deer,strong body  strength  go hunt  take muscle deer
context : i have a very strong body. @ path_tailentity : hunt deer,strong  strength  go hunt  take muscle  hunt deer
context : i have a very strong body. @ path_tailentity : hunt deer,strong body  hiking  outdoor activity  hike  climb  be shape  hunt deer
context : i have a very strong body. @ path_tailentity : hunt deer,strong body  hiking  outdoor activity  climb  work  be shape  hunt deer
context : i have a very strong body. @ path_tailentity : deer,strong body  hike  outdoor activity  outdoor activity  climb  work  deer
context : i have a very strong body. @ path_tailentity : deer,strong body  hike  outdoor activity  hiking  climb  be shape  deer
context : i have a very strong body. @ path_tailentity : hunt deer,strong  hard work  climb  outdoor activity  outdoor activity  hike  hunt deer
context : i enjoy sharing my voice. @ path_tailentity : feel drawn,enjoy everything person  voice  story  i m  share  feel drawn
context : i enjoy sharing my voice. @ path_tailentity : feel drawn,enjoy everything person  voice  story  share  i  feel drawn
context : i enjoy sharing my voice. @ path_tailentity : drawn,enjoy everything person  voice  share story  i  drawn
context : i enjoy sharing my voice. @ path_tailentity : many object,enjoy everything person  voice  share story  i  many object
context : i enjoy sharing my voice. @ path_tailentity : many object,enjoy everyone person  voice  share story  i  many object
context : i enjoy sharing my voice. @ path_tailentity : feel drawn,enjoy  have passion  think  voice work  depends context  feel drawn
context : i enjoy sharing my voice. @ path_tailentity : feel drawn,enjoy think  has passion  have passion  voice work  feel drawn
context : i enjoy sharing my voice. @ path_tailentity : feel drawn,enjoy  have passion for  think  voice work  depends context  feel drawn
context : i enjoy sharing my voice. @ path_tailentity : drawn,enjoy  have passion  think  voice work  depends context  drawn
context : i enjoy sharing my voice. @ path_tailentity : many object,enjoy  think  have passion  have passion  voice work  many object
context : i enjoy sharing my voice. @ path_tailentity : many object,enjoy  think  have passion  voice work  depends context  many object
context : i enjoy sharing my voice. @ path_tailentity : feel drawn,enjoy  sing  sing object  feel drawn
context : i enjoy sharing my voice. @ path_tailentity : drawn,enjoy  sing  sing object  drawn
context : i enjoy sharing my voice. @ path_tailentity : many object,enjoy  sing  sing object  many object
context : i try to avoid driving short distances when able. @ path_tailentity : wear lot,avoid drive  walk person  wear lot
context : i try to avoid driving short distances when able. @ path_tailentity : wear,avoid drive  walk person  wear
context : i try to avoid driving short distances when able. @ path_tailentity : wear lot,avoid  walk person  wear lot
context : i try to avoid driving short distances when able. @ path_tailentity : wear lot,avoid drive  ride  not bother drive  ride  city  wear lot
context : i try to avoid driving short distances when able. @ path_tailentity : wear,avoid drive  ride  not bother drive  ride  city  wear
context : i try to avoid driving short distances when able. @ path_tailentity : wear lot,avoid  ride  not bother drive not bother drive  city  wear lot
context : i try to avoid driving short distances when able. @ path_tailentity : wear lot,avoid  ride  not bother drive not bother drive  always walk  wear lot
context : i try to avoid driving short distances when able. @ path_tailentity : wear lot,avoid drive  stay home loner  always be  lonely  wear lot
context : i try to avoid driving short distances when able. @ path_tailentity : wear,avoid drive  stay home  loner  always be  lonely  wear
context : i try to avoid driving short distances when able. @ path_tailentity : wear lot,avoid  always be  stay home loner  loner  wear lot
context : i try to avoid driving short distances when able. @ path_tailentity : wear lot,avoid  loner  always be  stay home  lonely  wear lot
context : i try to avoid driving short distances when able. @ path_tailentity : wear lot,avoid drive  see night  wear lot
context : i try to avoid driving short distances when able. @ path_tailentity : wear,avoid drive  see night  wear
context : i try to avoid driving short distances when able. @ path_tailentity : wear lot,avoid  see night  wear lot
context : i try to avoid driving short distances when able. @ path_tailentity : wear lot,avoid drive  walk  sneak person  surprise  want  wear lot
context : i try to avoid driving short distances when able. @ path_tailentity : wear lot,avoid drive  walk  sneak person people person  want  wear lot
context : i try to avoid driving short distances when able. @ path_tailentity : wear,avoid drive  walk  sneak person people person  want  wear
context : i try to avoid driving short distances when able. @ path_tailentity : wear,avoid drive  walk  sneak person  surprise  people person  wear
context : i try to avoid driving short distances when able. @ path_tailentity : wear lot,avoid  sneak person  people person  walk  want  wear lot
context : i enjoy listening to pop punk music. @ path_tailentity : internet,punk music  cool music  listen  do work home job online  computer  internet
context : i enjoy listening to pop punk music. @ path_tailentity : internet,punk music  cool music  listen  do work  home job online love  internet
context : i enjoy listening to pop punk music. @ path_tailentity : internet,punk music  cool music  listen  do work home job online  love  internet
context : i enjoy listening to pop punk music. @ path_tailentity : internet,punk music  cool music  listen  listen  do work home job online  internet
context : i enjoy listening to pop punk music. @ path_tailentity : internet,punk  home job online  do work  love  cool music  internet
context : i enjoy listening to pop punk music. @ path_tailentity : internet,punk  love  home job online  do work do music  internet
context : i enjoy listening to pop punk music. @ path_tailentity : office,punk music  cool music  listen  do work home job online  computer  office
context : i enjoy listening to pop punk music. @ path_tailentity : office,punk music  cool music  listen  do work home job online  love  office
context : i enjoy listening to pop punk music. @ path_tailentity : internet,punk music  mostly listen  internet
context : i enjoy listening to pop punk music. @ path_tailentity : internet,punk  mostly listen  internet
context : i enjoy listening to pop punk music. @ path_tailentity : office,punk music  mostly listen  office
context : i enjoy listening to pop punk music. @ path_tailentity : internet,punk music  listen music  work  internet
context : i enjoy listening to pop punk music. @ path_tailentity : internet,punk music  listen music  be work  internet
context : i enjoy listening to pop punk music. @ path_tailentity : internet,punk  listen music  work  internet
context : i enjoy listening to pop punk music. @ path_tailentity : internet,punk  listen music  be work  internet
context : i enjoy listening to pop punk music. @ path_tailentity : office,punk music  listen music  be work  office
context : i enjoy listening to pop punk music. @ path_tailentity : office,punk music  listen music  work  office
context : children in elementary shool are an enjoyment to work with. @ path_tailentity : want shape,elementary shool  set  first weight  professional bodybuilder  want shape
context : children in elementary shool are an enjoyment to work with. @ path_tailentity : get shape,elementary shool  first weight  set  professional bodybuilder  get shape
context : children in elementary shool are an enjoyment to work with. @ path_tailentity : shape,elementary shool  first weight  set  professional bodybuilder  shape
context : children in elementary shool are an enjoyment to work with. @ path_tailentity : want shape,elementary shool  pe teacher  elementary school  work  want shape
context : children in elementary shool are an enjoyment to work with. @ path_tailentity : get shape,elementary shool  pe teacher  elementary school  work  get shape
context : children in elementary shool are an enjoyment to work with. @ path_tailentity : shape,elementary shool  pe teacher  elementary school  work  shape
context : i enjoy eating meat from cows. @ path_tailentity : listen music,eat cow unhealthy food heat  work  walk treadmill  listen music
context : i enjoy eating meat from cows. @ path_tailentity : listen music,eat cow unsavory food heat  work  walk treadmill  listen music
context : i enjoy eating meat from cows. @ path_tailentity : listen,eat cow unsavory food heat  work  walk treadmill  listen
context : i enjoy eating meat from cows. @ path_tailentity : listen,eat cow unhealthy food heat  work  walk treadmill  listen
context : i enjoy eating meat from cows. @ path_tailentity : listen music,cow  walk treadmill  work _ unhealthy food heat  listen music
context : i enjoy eating meat from cows. @ path_tailentity : listen music,cow  walk treadmill  work  unhealthy food heat  listen music
context : i enjoy eating meat from cows. @ path_tailentity : listen music,eat cow watch  listen  listen music
context : i enjoy eating meat from cows. @ path_tailentity : listen,eat cow watch  listen  listen
context : i enjoy eating meat from cows. @ path_tailentity : listen music,cow  watch  listen to music
context : i enjoy eating meat from cows. @ path_tailentity : listen music,cow  watch  listen  listen music
context : i enjoy eating meat from cows. @ path_tailentity : listen music,eat cow  meal person  relax  listen music
context : i enjoy eating meat from cows. @ path_tailentity : listen,eat cow  meal person  relax  listen
context : i enjoy eating meat from cows. @ path_tailentity : listen music,cow  meal person  relax  listen music
context : i am not a fan of science. @ path_tailentity : currently look,fan  science degree  just graduate  currently look
context : i am not a fan of science. @ path_tailentity : currently look,science  science degree  just graduate  currently look
context : i am not a fan of science. @ path_tailentity : job,fan  science degree  just graduate  job
context : i have a daughter. @ path_tailentity : great cook,have daughter  cook meal  have family  person  friendly recipe  great cook
context : i have a daughter. @ path_tailentity : cook,have daughter  have family  cook meal  friendly recipe  cook
context : i have a daughter. @ path_tailentity : great cook,daughter  family  cook meal  have family  have food  great cook
context : i have a daughter. @ path_tailentity : great cook,daughter  family  cook meal  have family  friendly recipe  great cook
context : i have a daughter. @ path_tailentity : great cook,daughter  have family  cook meal  have cookbook  friendly recipe  great cook
context : i have a daughter. @ path_tailentity : great cook,have daughter  child  do say  horticulture  hobby  time  i  great cook
context : i have a daughter. @ path_tailentity : cook,have daughter  child  i  m  time  do say  develop  hobby  cook
context : i have a daughter. @ path_tailentity : cook,have daughter  child  do say  child development  hobby  develop  i  cook
context : i have a daughter. @ path_tailentity : cook,have daughter  child  do say  child  hobby  i  m  cook
context : i dislike hatred. @ path_tailentity : stuff,dislike  surround happiness thing  comfort  stuff
context : i dislike hatred. @ path_tailentity : stuff,hatred  thing  surround happiness  comfort  stuff
context : i dislike hatred. @ path_tailentity : stuff,hatred  emotion  comfort thing  stuff
context : i dislike hatred. @ path_tailentity : stuff,dislike  fed  thing  feed  stuff
context : i dislike hatred. @ path_tailentity : stuff,hatred  thing  fed  feed stuff
context : i dislike hatred. @ path_tailentity : stuff,hatred  feed fed  thing  stuff
context : i work at a juice business. @ path_tailentity : area institute,juice business  study  area institute
context : i work at a juice business. @ path_tailentity : institute,juice business  study  institute
context : i work at a juice business. @ path_tailentity : area institute,juice  study  area institute
context : i work at a juice business. @ path_tailentity : area institute,juice business  love juice  day  go class  area institute
context : i work at a juice business. @ path_tailentity : area institute,juice business  love juice  day  go class area institute
context : i work at a juice business. @ path_tailentity : institute,juice business  love juice  day  go class  institute
context : i work at a juice business. @ path_tailentity : institute,juice business  love juice  day  go class  institute
context : i work at a juice business. @ path_tailentity : area institute,juice  love juice  day  go class area institute
context : i work at a juice business. @ path_tailentity : area institute,juice  love juice  day  go class area institute
context : i work at a juice business. @ path_tailentity : area institute,juice business  pay school area institute
context : i work at a juice business. @ path_tailentity : institute,juice business  pay school institute
context : i work at a juice business. @ path_tailentity : area institute,juice  pay school area institute
context : i am a labor worker. @ path_tailentity : have pet,labor worker  ami  ami not work  not work  have pet
context : i am a labor worker. @ path_tailentity : pet,labor worker  not work  am i  am i  am i  pet
context : i am a labor worker. @ path_tailentity : have pet,worker  am i  am i  not work  am i  have pet
context : i am a labor worker. @ path_tailentity : have pet,worker  musher  alaska  large dog  hunt  sleigh  sometimes work pull  have pet
context : i am a labor worker. @ path_tailentity : have pet,labor worker  see pet  love  have pet
context : i am a labor worker. @ path_tailentity : pet,labor worker  see pet  love  pet
context : i am a labor worker. @ path_tailentity : have pet,worker  love  see pet  have pet
context : i am a labor worker. @ path_tailentity : have pet,worker  see pet  love  have pet
context : i work in the healthcare industry. @ path_tailentity : adorn thing,healthcare industry  epidermatology  adorn thing
context : i work in the healthcare industry. @ path_tailentity : adorn,healthcare industry  epidermatology  adorn
context : i work in the healthcare industry. @ path_tailentity : adorn,healthcare industry  epidermatology _field adorn
context : i work in the healthcare industry. @ path_tailentity : adorn thing,healthcare industry  job  makeup person  makeup  want  buy  adorn thing
context : i work in the healthcare industry. @ path_tailentity : adorn thing,healthcare industry  job  makeup person  makeup person  buy  want  adorn thing
context : i work in the healthcare industry. @ path_tailentity : adorn thing,healthcare industry  job  makeup person  want  buy  makeup adorn thing
context : i work in the healthcare industry. @ path_tailentity : adorn,healthcare industry  job  makeup person  makeup person  buy  want  adorn
context : i work in the healthcare industry. @ path_tailentity : adorn thing,healthcare  job  makeup person  makeup person  want  buy  adorn thing
context : my career is that of a physical performer. @ path_tailentity : enjoy,physical performer  performer  stage  dance  i  m  love take  enjoy
context : my career is that of a physical performer. @ path_tailentity : enjoy,performer  dance  i m  stage  stage  sing  love take  enjoy
context : my career is that of a physical performer. @ path_tailentity : share,physical performer  m  dance  sing  stage  stage  love take  share
