inputs,target
context : i like earth. @ path_tailentity : different food,earth  people  come  different food
context : i like earth. @ path_tailentity : food,earth  people  come home  food
context : i like earth. @ path_tailentity : food,earth  come people  food
context : i like earth. @ path_tailentity : cook,earth  grows earth cook
context : i like earth. @ path_tailentity : different food,earth  grows earth different food
context : i am a child. @ path_tailentity : visit,child  visit
context : i am a child. @ path_tailentity : have lot,child  parent  have fun  have lot
context : i am a child. @ path_tailentity : visit place,child  have fun  parent  visit place
context : i am a child. @ path_tailentity : visit place,child  have fun  parent  visit place
context : i am a child. @ path_tailentity : visit,child  have fun  parent  visit
context : i am a child. @ path_tailentity : visit,child  have fun  parent  visit
context : my sibling likes to write. @ path_tailentity : use,sibling like  sport  write person  use
context : my sibling likes to write. @ path_tailentity : use,sibling  sport  write person  use
context : my sibling likes to write. @ path_tailentity : use,write  write person sibling like  sport  use
context : my sibling likes to write. @ path_tailentity : use,sibling like  accident use
context : my sibling likes to write. @ path_tailentity : use,sibling  accident  use
context : my sibling likes to write. @ path_tailentity : use,write  accident use
context : my sibling likes to write. @ path_tailentity : use,sibling like  brother prefers sport use
context : my sibling likes to write. @ path_tailentity : use,sibling  brother prefers sport use
context : my sibling likes to write. @ path_tailentity : use,write  brother prefers sport use
context : i like puppies. @ path_tailentity : blue,puppy  name blue  favorite color  blue
context : i like puppies. @ path_tailentity : blue,puppy  dog  blue collar  blue
context : i like puppies. @ path_tailentity : blue,puppy  decide color  decanter  colar  blue
context : i have three great dogs. @ path_tailentity : meat,great dog  love animal  hurt  avoid anything  meat
context : i have three great dogs. @ path_tailentity : meat,great dog  love animal  harm  avoid anything  meat
context : i have three great dogs. @ path_tailentity : meat,great dog  love animal  avoid anything  hurt  meat
context : i have three great dogs. @ path_tailentity : meat,dog  love animal  love animal  harm meat
context : i have three great dogs. @ path_tailentity : meat,dog  love animal  hurt  avoid anything  meat
context : i have three great dogs. @ path_tailentity : meat,dog  love animal  harm  avoid anything  meat
context : i have three great dogs. @ path_tailentity : eat,great dog  love animal  harm  avoid anything  eat
context : i have three great dogs. @ path_tailentity : eat,great dog  love animal  harm  avoid anything  eat
context : i have three great dogs. @ path_tailentity : meat,great dog  animal  whole lot  meat
context : i have three great dogs. @ path_tailentity : meat,dog  whole lot  animal  meat
context : i have three great dogs. @ path_tailentity : eat,great dog  animal  whole lot  eat
context : i have three great dogs. @ path_tailentity : meat,great dog  animal lover  meat
context : i have three great dogs. @ path_tailentity : meat,dog  animal lover  meat
context : i have three great dogs. @ path_tailentity : eat,great dog  animal lover  eat
context : i have one pet. @ path_tailentity : enjoy speak,have pet  pet parakeet speaks  enjoy speak
context : i have one pet. @ path_tailentity : enjoy,have pet  pet parakeet speaks  enjoy
context : i have one pet. @ path_tailentity : enjoy speak,pet pet parakeet speaks  enjoy speak
context : i have one pet. @ path_tailentity : enjoy speak,pet parakeet speaks  pet parakeet speaks  enjoy speak
context : i have one pet. @ path_tailentity : enjoy speak,have pet  lonely  love speak  different language  communicate owner  own special language  enjoy speak
context : i have one pet. @ path_tailentity : enjoy speak,have pet  lonely  own special language  communicate owner language  different language  heard  enjoy speak
context : i have one pet. @ path_tailentity : enjoy speak,have pet  love speak  different language  heard  communicate owner  own special language  enjoy speak
context : i have one pet. @ path_tailentity : enjoy,have pet  own special language heard  love speak  communicate owner  enjoy
context : i have one pet. @ path_tailentity : enjoy speak,pet  love speak  speak  communicate owner heard  enjoy speak
context : i have one pet. @ path_tailentity : enjoy speak,pet love speak  speak  own special language  communicate owner  enjoy speak
context : i have one pet. @ path_tailentity : enjoy speak,pet love speak  speak  own special language  heard  enjoy speak
context : i have one pet. @ path_tailentity : enjoy speak,have pet  have person  poodle person  italian breeder  enjoy speak
context : i have one pet. @ path_tailentity : enjoy,have pet  have person poodle person  italian breeder  enjoy
context : i have one pet. @ path_tailentity : enjoy speak,pet poodle person  italian breeder _occupation italian breeder  enjoy speak
context : i lift a lot of weights. @ path_tailentity : gym,lift lot home  gym
context : i lift a lot of weights. @ path_tailentity : gym,lift weight  home  gym
context : i lift a lot of weights. @ path_tailentity : gym,lift  home  gym
context : i lift a lot of weights. @ path_tailentity : gym,lift weight weight lift  favorite hobby  gym
context : i lift a lot of weights. @ path_tailentity : gym,lift  weight lift  favorite hobby  gym
context : i am a student. @ path_tailentity : have child,student  school  i m married  be while  school  have child
context : i am a student. @ path_tailentity : child,student  school  i m married  be while  school  child
context : i am a student. @ path_tailentity : child,student  school  child
context : i am a student. @ path_tailentity : have child,student  adult  attend college  have child
context : i am a student. @ path_tailentity : child,student  attend college  adult  child
context : i complete school this year. @ path_tailentity : join education,complete school master  teach  join education
context : i complete school this year. @ path_tailentity : join,complete school teacher  teach  join
context : i complete school this year. @ path_tailentity : join education,complete master  teach  join education
context : i complete school this year. @ path_tailentity : join education,complete school level  earn money  live life  reliable way  i  join education
context : i complete school this year. @ path_tailentity : join,complete school i  live life  reliable way  level  earn money  join
context : i complete school this year. @ path_tailentity : join,complete school mary  live life  reliable way  level  earn money  join
context : i complete school this year. @ path_tailentity : join,complete school ileady  reliable way  live life  earn money  level  join
context : i complete school this year. @ path_tailentity : join,complete school school  level  earn money  live life  reliable way  i  join
context : i complete school this year. @ path_tailentity : join education,complete level  earn money  live life  reliable way  i  join education
context : i complete school this year. @ path_tailentity : join,complete school  have degree  finish college  person  glad person  become teacher  join
context : i complete school this year. @ path_tailentity : join,complete school graduate  have degree  become teacher  glad person  finish college  join
context : i complete school this year. @ path_tailentity : join education,complete finish college  graduate  have degree  become teacher glad person  join education
context : i rock out to old tunes. @ path_tailentity : local bakery,old tune  dance oldie  work be driver  local bakery
context : i rock out to old tunes. @ path_tailentity : local bakery,old tune  dance oldie  work  drive local bakery
context : i rock out to old tunes. @ path_tailentity : bakery,old tune  dance oldie  work  be driver bakery
context : i rock out to old tunes. @ path_tailentity : local bakery,tune  dance oldie  work  be driver  local bakery
context : i rock out to old tunes. @ path_tailentity : local bakery,old tune  listen radio  do i  am drive  do bakery  delivery  local bakery
context : i rock out to old tunes. @ path_tailentity : bakery,old tune  listen radio  do i  am drive  do bakery  delivery  bakery
context : i rock out to old tunes. @ path_tailentity : local bakery,tune  listen radio  do i  am drive  do bakery  delivery  local bakery
context : i rock out to old tunes. @ path_tailentity : local bakery,tune  listen radio  do i  am drive  do i  delivery  local bakery
context : i dropped out of college. @ path_tailentity : army,drop college nnot afford  decide army
context : i dropped out of college. @ path_tailentity : army,drop  decide  nnot afford  army
context : i dropped out of college. @ path_tailentity : army,college  decide  nnot afford army
context : i dropped out of college. @ path_tailentity : army,college  get doctor  want doctor army
context : i want to get my own place. @ path_tailentity : zero,want  live person  not afford  not afford  place person  zero
context : i want to get my own place. @ path_tailentity : zero,want  live person not afford  person  place person  zero
context : i want to get my own place. @ path_tailentity : zero,own place person  not afford  work  not afford  place person want _ zero
context : i want to get my own place. @ path_tailentity : zero,want  have money  have money  work money zero
context : i want to get my own place. @ path_tailentity : zero,want  work money have money  have money  zero
context : i want to get my own place. @ path_tailentity : zero,own place  work money  have money  have money  zero
context : i want to get my own place. @ path_tailentity : zero,own place  person  have money  work money zero
context : i want to get my own place. @ path_tailentity : zero,place  work money  have money  have money  zero
context : i want to get my own place. @ path_tailentity : zero,place  work money  have money  have money  zero
context : i want to get my own place. @ path_tailentity : zero,want  move parent  need good job  zero
context : i want to get my own place. @ path_tailentity : zero,want  move parent  good job  good job  zero
context : i want to get my own place. @ path_tailentity : zero,own place  need  move parent good job  want _ zero
context : i want to get my own place. @ path_tailentity : zero,own place  need want  move parent  good job  zero
context : i want to get my own place. @ path_tailentity : zero,own place  want need  good job  move parent zero
context : i want to get my own place. @ path_tailentity : zero,place  need  move parent  good job  zero
context : i am a musician. @ path_tailentity : own song,musician occupation musician career  write song  own song
context : i am a musician. @ path_tailentity : song,musician occupation musician career  write song  song
context : i am a musician. @ path_tailentity : write,musician occupation musician career  write song  write
context : i am a musician. @ path_tailentity : own song,musician  want share  feeling  own song
context : i am a musician. @ path_tailentity : own song,musician  want share  feeling _ own song
context : i am a musician. @ path_tailentity : own song,musician  fiddle  feeling  own song
context : i am a musician. @ path_tailentity : song,musician  want share  feeling  song
context : i am a musician. @ path_tailentity : write,musician  want share  feeling  write
context : i am a musician. @ path_tailentity : write,musician  want share  feeling  write
context : i am a musician. @ path_tailentity : write,musician _occupation feeling  want share  write
context : i am a student. @ path_tailentity : painting,student  major be  painting
context : i am a student. @ path_tailentity : painting,student  mom  always be  craft  begin  painting
context : i am a student. @ path_tailentity : painting,student  mom  always be  begin mom  painting
context : i am a student. @ path_tailentity : painting,student  start  begin mom  craft  painting
context : i am a student. @ path_tailentity : painting,student  start  begin  always be  craft  painting
context : i am a student. @ path_tailentity : painting,student  love  thunder  painting
context : i like to read horror novels. @ path_tailentity : go lake,horror novel  love story  take place  take place  favorite horror movie  go lake
context : i like to read horror novels. @ path_tailentity : go lake,horror novel  favorite horror movie  take place  take walk  love  go lake
context : i like to read horror novels. @ path_tailentity : go lake,horror novel  love  favorite horror movie  take place  take lake  go lake
context : i like to read horror novels. @ path_tailentity : go lake,horror novel  love story  favorite horror movie  take place  take lake  go lake
context : i like to read horror novels. @ path_tailentity : lake,horror novel  favorite horror movie  favorite love  take place  take lake  lake
context : i like to read horror novels. @ path_tailentity : lake,horror novel  love  take place take place  favorite horror movie  lake
context : i like to read horror novels. @ path_tailentity : lake,horror novel  favorite horror movie  take place  take walk  love  lake
context : i like to read horror novels. @ path_tailentity : go lake,novel  love  favorite horror movie  take place  take lake  go lake
context : i like to read horror novels. @ path_tailentity : go lake,novel  love  take place love  favorite horror movie  go lake
context : i like to read horror novels. @ path_tailentity : go lake,novel  love  take place love  favorite horror movie  go lake
context : i like to read horror novels. @ path_tailentity : go lake,horror novel  also enjoy  outdoors  go lake
context : i like to read horror novels. @ path_tailentity : lake,horror novel  also enjoy outdoors  lake
context : i like to read horror novels. @ path_tailentity : go lake,novel  outdoors  also enjoy  go lake
context : i live by the ocean. @ path_tailentity : weird hobby,ocean  area  see lot  see reptile  love  weird hobby
context : i live by the ocean. @ path_tailentity : hobby,ocean  ocean  see lot  see reptile  love  hobby
context : i live by the ocean. @ path_tailentity : giant reptile,ocean  ocean  see lot  see reptile love  giant reptile
context : i live by the ocean. @ path_tailentity : giant reptile,ocean  see lot  see lot  person  love  giant reptile
context : i live by the ocean. @ path_tailentity : giant reptile,ocean  area  see lot  see lot  love giant reptile
context : i live by the ocean. @ path_tailentity : giant reptile,ocean  area  see lot  see reptile  love _genus giant reptile
context : i live by the ocean. @ path_tailentity : giant reptile,ocean  see lot  see lot  dog  area  giant reptile
context : i live by the ocean. @ path_tailentity : hobby,ocean  enjoy water hobby
context : i live by the ocean. @ path_tailentity : hobby,ocean  beach  many lizard  hobby
context : my job requires me to be there three days a week. @ path_tailentity : hop,require go pub  hop
context : my job requires me to be there three days a week. @ path_tailentity : hop,job  day  go pub  hop
context : my job requires me to be there three days a week. @ path_tailentity : hop,job  go pub  day  hop
context : my job requires me to be there three days a week. @ path_tailentity : barley,require go pub  barley
context : my job requires me to be there three days a week. @ path_tailentity : hop,require life  uncertainty  think many drink cope  hop
context : my job requires me to be there three days a week. @ path_tailentity : hop,require  life  uncertainty  unfavorable work condition  think many drink hop
context : my job requires me to be there three days a week. @ path_tailentity : hop,require life  unfavorable work condition  think many drink  cope  hop
context : my job requires me to be there three days a week. @ path_tailentity : hop,job  life  uncertainty  unfavorable work condition  think many drink hop
context : my job requires me to be there three days a week. @ path_tailentity : hop,job  life  unfavorable work condition  think many drink cope  hop
context : my job requires me to be there three days a week. @ path_tailentity : barley,require life  uncertainty  unfavorable work condition  think many drink  barley
context : my job requires me to be there three days a week. @ path_tailentity : barley,require life  uncertainty  think many drink cope  barley
context : my job requires me to be there three days a week. @ path_tailentity : barley,require life  unfavorable work condition  think many drink cope  barley
context : my job requires me to be there three days a week. @ path_tailentity : barley,require life  worry  think many drink unfavorable work condition  barley
context : my clothes are usually dark colors. @ path_tailentity : vehicle,dark color  choker  buy  chose person vehicle
context : my clothes are usually dark colors. @ path_tailentity : vehicle,color  everything person  buy  chose person  vehicle
context : my clothes are usually dark colors. @ path_tailentity : vehicle,clothes  everything person  chose person  buy  vehicle
context : my clothes are usually dark colors. @ path_tailentity : vehicle,dark color  darker color  wear lot else do  home  notice  vehicle
context : my clothes are usually dark colors. @ path_tailentity : vehicle,dark color  darker color  lighter color  wear lot else do  home  vehicle
context : my clothes are usually dark colors. @ path_tailentity : vehicle,dark color  darker color  darker color  wear lot else do  home  vehicle
context : my clothes are usually dark colors. @ path_tailentity : vehicle,color  darker color  darker color  wear lot else do  home  vehicle
context : my clothes are usually dark colors. @ path_tailentity : vehicle,color  darker color  wear lot else do  notice  home  vehicle
context : my clothes are usually dark colors. @ path_tailentity : vehicle,clothes  home  dark color  darker color  dark color  notice  wear lot  else do  vehicle
context : my clothes are usually dark colors. @ path_tailentity : vehicle,dark color  favorite color  vehicle
context : my clothes are usually dark colors. @ path_tailentity : vehicle,color  favorite color  vehicle
context : my clothes are usually dark colors. @ path_tailentity : vehicle,clothes  dark color  favorite color vehicle
context : my clothes are usually dark colors. @ path_tailentity : vehicle,dark color  bright color  car  pattern  vehicle
context : my clothes are usually dark colors. @ path_tailentity : vehicle,color  bright color  car  pattern  vehicle
context : my clothes are usually dark colors. @ path_tailentity : vehicle,clothes  car  bright color  pattern  vehicle
context : my clothes are usually dark colors. @ path_tailentity : vehicle,clothes  pattern  pattern  car _product vehicle
context : my clothes are usually dark colors. @ path_tailentity : vehicle,dark color  favorite color  vehicle
context : my clothes are usually dark colors. @ path_tailentity : vehicle,color  favorite color  vehicle
context : my clothes are usually dark colors. @ path_tailentity : vehicle,clothes  dark color  favorite color vehicle
context : my clothes are usually dark colors. @ path_tailentity : vehicle,color sky  vehicle
context : my clothes are usually dark colors. @ path_tailentity : vehicle,clothes  dark color  vehicle
context : my clothes are usually dark colors. @ path_tailentity : vehicle,dark color  bright clothes  dark car  vehicle
context : my clothes are usually dark colors. @ path_tailentity : vehicle,color  bright clothes  dark car  vehicle
context : my clothes are usually dark colors. @ path_tailentity : vehicle,clothes  dark car  bright clothes  vehicle
context : my clothes are usually dark colors. @ path_tailentity : vehicle,dark color  darker shade  stick  tend  vehicle
context : my clothes are usually dark colors. @ path_tailentity : vehicle,dark color  yellow  stick  tend vehicle
context : my clothes are usually dark colors. @ path_tailentity : vehicle,color  darker shade  tend stick  vehicle
context : my clothes are usually dark colors. @ path_tailentity : vehicle,clothes  wear  stick  darker shade  vehicle
context : my clothes are usually dark colors. @ path_tailentity : vehicle,clothes  tend stick  darker shade  vehicle
context : i like my job. @ path_tailentity : knit present,job  earn job money person  buying gift  knit present
context : i like my job. @ path_tailentity : knit,job  earn job money person  buying gift  knit
context : i like my job. @ path_tailentity : friend,job  earn job money person  buying gift ca friend
context : i like my job. @ path_tailentity : knit present,job  make money  work  knit person  friend  knit present
context : i like my job. @ path_tailentity : knit,job  make money  work  knit person  knit
context : i like my job. @ path_tailentity : friend,job  make money  knit person  work  friend
context : i like my job. @ path_tailentity : knit present,job  hobby  knitting ca concentrate  knit friend  quit job  knit present
context : i like my job. @ path_tailentity : knit,job  hobby  knitting  concentrate  knit friend  quit job  knit
context : i like my job. @ path_tailentity : friend,job  hobby  knitting  concentrate  knit friend  quit job friend
context : i like to watch foreign television. @ path_tailentity : grandmother,foreign television  watch television family  grandmother
context : i like to watch foreign television. @ path_tailentity : grandmother,foreign television  watch television family  grandmother
context : i like to watch foreign television. @ path_tailentity : grandmother,television  watch television family  grandmother
context : i enjoy books and resting by inland bodies of water on saturdays and sundays. @ path_tailentity : helpe,inland body  sound  day  week  lounge  helpe
context : i enjoy books and resting by inland bodies of water on saturdays and sundays. @ path_tailentity : helpe,inland body  sound  sound  day  lounge  helpe
context : i enjoy books and resting by inland bodies of water on saturdays and sundays. @ path_tailentity : helpe,inland  week  sound  lounge  helpe
context : i enjoy books and resting by inland bodies of water on saturdays and sundays. @ path_tailentity : helpe,inland  sound  sound  lounge  helpe
context : i enjoy books and resting by inland bodies of water on saturdays and sundays. @ path_tailentity : helpe,inland  lounge  sound  music  helpe
context : i enjoy books and resting by inland bodies of water on saturdays and sundays. @ path_tailentity : helpe,saturday  week  sound  lounge  helpe
context : i enjoy books and resting by inland bodies of water on saturdays and sundays. @ path_tailentity : helpe,saturday  weekday  sound  lounge  helpe
context : i enjoy books and resting by inland bodies of water on saturdays and sundays. @ path_tailentity : helpe,inland body  kid thing person  learn  helpe
context : i enjoy books and resting by inland bodies of water on saturdays and sundays. @ path_tailentity : helpe,inland  kid thing person  learn  helpe
context : i enjoy books and resting by inland bodies of water on saturdays and sundays. @ path_tailentity : helpe,saturday  kid thing person  learn  helpe
context : i enjoy books and resting by inland bodies of water on saturdays and sundays. @ path_tailentity : helpe,inland body  summer camp  swim  practice water safety  work  helpe
context : i enjoy books and resting by inland bodies of water on saturdays and sundays. @ path_tailentity : helpe,inland  summer camp  swim  practice water safety  work  helpe
context : i enjoy books and resting by inland bodies of water on saturdays and sundays. @ path_tailentity : helpe,inland  summer camp  summer camp  swim  practice water safety helpe
context : i enjoy books and resting by inland bodies of water on saturdays and sundays. @ path_tailentity : helpe,inland  summer camp  practice water safety  swim  work  helpe
context : i enjoy books and resting by inland bodies of water on saturdays and sundays. @ path_tailentity : helpe,inland  winter camp  swim  practice water safety  work helpe
context : i enjoy books and resting by inland bodies of water on saturdays and sundays. @ path_tailentity : helpe,saturday  summer camp  swim  practice water safety  work  helpe
context : i enjoy books and resting by inland bodies of water on saturdays and sundays. @ path_tailentity : helpe,inland body  child  do work  do work  enjoy reading  read  also require  helpe
context : i enjoy books and resting by inland bodies of water on saturdays and sundays. @ path_tailentity : helpe,inland  child  do work  do work  enjoy reading  read  also require  do work  helpe
context : i enjoy books and resting by inland bodies of water on saturdays and sundays. @ path_tailentity : helpe,saturday  do work  do work  enjoy reading child  also require  read  begin
context : i enjoy books and resting by inland bodies of water on saturdays and sundays. @ path_tailentity : helpe,inland body  work librarian  helpe
context : i enjoy books and resting by inland bodies of water on saturdays and sundays. @ path_tailentity : helpe,inland body  work  librarian  guide  helpe
context : i enjoy books and resting by inland bodies of water on saturdays and sundays. @ path_tailentity : helpe,inland body  librarian  work  guide
context : i enjoy books and resting by inland bodies of water on saturdays and sundays. @ path_tailentity : helpe,inland  librarian  work  helpe
context : i enjoy books and resting by inland bodies of water on saturdays and sundays. @ path_tailentity : helpe,inland  work  librarian  guide  helpe
