inputs,target
context : hearing people sing from the heart can move me to tears. @ path_tailentity : devour,sing heart reading person  read book  music  devour
context : hearing people sing from the heart can move me to tears. @ path_tailentity : devour,sing heart reading person  read book  music  devour
context : hearing people sing from the heart can move me to tears. @ path_tailentity : devour,move tear  make cry  devour
context : hearing people sing from the heart can move me to tears. @ path_tailentity : devour,tear  make cry devour
context : hearing people sing from the heart can move me to tears. @ path_tailentity : devour,sing heart  make cry  devour
context : hearing people sing from the heart can move me to tears. @ path_tailentity : devour,move tear other thing capture  attention  devour
context : hearing people sing from the heart can move me to tears. @ path_tailentity : devour,tear  other thing capture  attention  devour
context : hearing people sing from the heart can move me to tears. @ path_tailentity : devour,sing heart other thing capture  attention  devour
context : hearing people sing from the heart can move me to tears. @ path_tailentity : devour,move tear romance novel  same effect  devour
context : hearing people sing from the heart can move me to tears. @ path_tailentity : devour,tear  romance novel  same effect _ devour
context : hearing people sing from the heart can move me to tears. @ path_tailentity : devour,sing heart  romance novel  same effect _ devour
context : hearing people sing from the heart can move me to tears. @ path_tailentity : devour,sing heart romance novel  same effect  devour
context : hearing people sing from the heart can move me to tears. @ path_tailentity : devour,move tear  love reading  music  devour
context : hearing people sing from the heart can move me to tears. @ path_tailentity : devour,tear  music  love reading  devour
context : hearing people sing from the heart can move me to tears. @ path_tailentity : devour,sing heart love reading  music  devour
context : hearing people sing from the heart can move me to tears. @ path_tailentity : devour,move tear  really write author  favorite kind  devour
context : hearing people sing from the heart can move me to tears. @ path_tailentity : devour,tear really write  write author  devour
context : hearing people sing from the heart can move me to tears. @ path_tailentity : devour,sing heart author  really write  really write devour
context : hearing people sing from the heart can move me to tears. @ path_tailentity : devour,sing heart really write  write  favorite kind  devour
context : hearing people sing from the heart can move me to tears. @ path_tailentity : devour,move tear  reading  good book  devour
context : hearing people sing from the heart can move me to tears. @ path_tailentity : devour,tear  reading  good book  devour
context : hearing people sing from the heart can move me to tears. @ path_tailentity : devour,sing heart good book  reading  devour
context : i love dogs. @ path_tailentity : mother,love dog  have dog  be grow be mom  mother
context : i love dogs. @ path_tailentity : mother,dog  have dog  have dog  be grow mother
context : i love dogs. @ path_tailentity : dog,love  have dog  be grow  have dog  dog
context : i love dogs. @ path_tailentity : mother,love dog  be grow mother
context : i love dogs. @ path_tailentity : mother,dog  be grow  mother
context : i love dogs. @ path_tailentity : dog,love  be grow dog
context : i love dogs. @ path_tailentity : mother,love dog mother
context : i love dogs. @ path_tailentity : mother,dog mother
context : i love dogs. @ path_tailentity : dog,love  dog
context : i have a son. @ path_tailentity : husband,have son  love  life  husband
context : i have a son. @ path_tailentity : husband,son  life  love  husband
context : i have a son. @ path_tailentity : work government,have son  love  life  work government
context : i am a happy person. @ path_tailentity : sunny,happy person  make happiest  hobby  sunny
context : i am a happy person. @ path_tailentity : sunny day,happy  make happiest  hobby  sunny day
context : i am a happy person. @ path_tailentity : sunny day,happy  make happy  hobby  sunny day
context : i am a happy person. @ path_tailentity : sunny day,happy person  take walk  sunny day
context : i am a happy person. @ path_tailentity : sunny,happy person  take walk  sunny
context : i am a happy person. @ path_tailentity : sunny,happy person  take walk  sunny
context : i am a happy person. @ path_tailentity : sunny day,happy  take walk  sunny day
context : i eat a lot. @ path_tailentity : have ponytail,eat lot  food preference correlate  hair color  wonder  have ponytail
context : i eat a lot. @ path_tailentity : ponytail,eat lot  eat healthily  hair color  food preference correlate  ponytail
context : i eat a lot. @ path_tailentity : ponytail,eat lot  eat healthily  food preference correlate  hair color  ponytail
context : i eat a lot. @ path_tailentity : have ponytail,eat  food preference correlate  hair color  wonder  have ponytail
context : i eat a lot. @ path_tailentity : have ponytail,eat lot  compare food  compare food have ponytail
context : i eat a lot. @ path_tailentity : have ponytail,eat lot  compare food  compare everything have ponytail
context : i eat a lot. @ path_tailentity : ponytail,eat lot  compare food  compare everything ponytail
context : i eat a lot. @ path_tailentity : have ponytail,eat  compare food  compare everything have ponytail
context : i eat a lot. @ path_tailentity : have ponytail,eat  compare food compare food  have ponytail
context : i eat a lot. @ path_tailentity : have ponytail,eat lot meal person  do hair  have ponytail
context : i eat a lot. @ path_tailentity : have ponytail,eat meal person  do hair  have ponytail
context : i have a couple of paintings on my body. @ path_tailentity : salon,have painting  tattoo salon  salon
context : i have a couple of paintings on my body. @ path_tailentity : salon,painting  tattoo salon  salon
context : i have a couple of paintings on my body. @ path_tailentity : salon,have couple  have painting tattoo salon  salon
context : i have a couple of paintings on my body. @ path_tailentity : salon,painting  tattoo parlor  salon
context : i have a couple of paintings on my body. @ path_tailentity : salon,have couple  tattoo parlor  salon
context : i have a couple of paintings on my body. @ path_tailentity : salon,have couple  have haircut  job  uncovered  allows people  salon
context : i have a couple of paintings on my body. @ path_tailentity : salon,have couple  have checkup  job  allows people  uncovered  salon
context : i have a couple of paintings on my body. @ path_tailentity : salon,have couple  keep tattoo  allows people job  discovered  salon
context : i am a happy person. @ path_tailentity : sing,happy person  love karoke  sing
context : i am a happy person. @ path_tailentity : sing,happy  love karoke  sing
context : i am a happy person. @ path_tailentity : many song,happy person  sing  love karoke  many song
context : i am a happy person. @ path_tailentity : sing,happy person  sing person  sing
context : i am a happy person. @ path_tailentity : sing,happy  sing person  sing
context : i am a happy person. @ path_tailentity : many song,happy person  sing person  many song
context : i am a happy person. @ path_tailentity : sing,happy person  happy mood  sing song  sing radio  good mood  sing
context : i am a happy person. @ path_tailentity : many song,happy person  happy mood  sing song  sing radio  good mood  many song
context : i start putting up ornaments and garlands early in december. @ path_tailentity : catch animal,garland  christmas feast  go hunt  catch animal
context : i start putting up ornaments and garlands early in december. @ path_tailentity : catch animal,garland  christmas feast  go hunt  catch animal
context : i start putting up ornaments and garlands early in december. @ path_tailentity : catch,garland  christmas feast  go hunt  catch
context : i start putting up ornaments and garlands early in december. @ path_tailentity : catch,garland  christmas feast  go hunt  catch
context : i start putting up ornaments and garlands early in december. @ path_tailentity : animal,garland  christmas feast  go hunt animal
context : i start putting up ornaments and garlands early in december. @ path_tailentity : catch animal,garland  ornament  look  favorite animal  catch animal
context : i start putting up ornaments and garlands early in december. @ path_tailentity : catch,garland  ornament  look  favorite animal  catch
context : i start putting up ornaments and garlands early in december. @ path_tailentity : animal,garland  ornament  look  favorite animal  animal
context : i start putting up ornaments and garlands early in december. @ path_tailentity : catch,garland  christmas ornament  decorate  december  accident  catch one  catch
context : i start putting up ornaments and garlands early in december. @ path_tailentity : catch,garland  christmas ornament  december  july  catch one  accident  catch
context : i will be attending college in california. @ path_tailentity : chill web,california  don'thing  don'thing  use nothing chill web
context : i will be attending college in california. @ path_tailentity : web,california  don'thing  don'thing  use nothing  web
context : i will be attending college in california. @ path_tailentity : chill web,be attend  do college  don'thing don'thing chill web
context : i will be attending college in california. @ path_tailentity : chill web,be attend  do college  don'thing  use nothing chill web
context : i will be attending college in california. @ path_tailentity : chill web,be attend  attend school  instead opt  online university  traditional college  passion  chill web
context : i am a musician with a day job. @ path_tailentity : be learn,musician  several different hobby  be learn
context : i am a musician with a day job. @ path_tailentity : learn,musician  several different hobby  learn
context : i am a musician with a day job. @ path_tailentity : garden,musician  several different hobby  garden
context : i am a musician with a day job. @ path_tailentity : be learn,musician  outside work  enjoy  do something  be learn
context : i am a musician with a day job. @ path_tailentity : learn,musician occupation outside work  enjoy  do something  learn
context : i am a musician with a day job. @ path_tailentity : learn,musician  outside work  enjoy  do something  learn
context : i am a musician with a day job. @ path_tailentity : learn,musician  outside work  enjoy  do something  learn
context : i am a musician with a day job. @ path_tailentity : garden,musician  outside work  enjoy  do something garden
context : i am a musician with a day job. @ path_tailentity : garden,musician occupation outside work  enjoy  do something  garden
context : i am a musician with a day job. @ path_tailentity : be learn,musician  garden  day job  be learn
context : i am a musician with a day job. @ path_tailentity : learn,musician occupation day job  learn
context : i am a musician with a day job. @ path_tailentity : garden,musician occupation day job  garden
context : i like trips to the ocean. @ path_tailentity : hospital,trip  take week  take week  travel  sound fun  vacation  hospital
context : i like trips to the ocean. @ path_tailentity : hospital,trip  take week  vacation  sound fun  take hospital  need week  hospital
context : i like trips to the ocean. @ path_tailentity : hospital,trip  sound fun  sound fun vacation  take week  need week  hospital
context : i like trips to the ocean. @ path_tailentity : hospital,ocean  vacation  take week  need week  travel  sound fun  hospital
context : i like trips to the ocean. @ path_tailentity : hospital,ocean  vacation  take week  take hospital  person  sound fun hospital
context : i like trips to the ocean. @ path_tailentity : hospital,ocean  ocean tides  sound fun  take week  vacation  take hospital  hospital
context : i like trips to the ocean. @ path_tailentity : work,trip  take week  vacation  need week  travel  sound fun  work
context : i like trips to the ocean. @ path_tailentity : work,trip  take week  vacation  sound fun  vacation  need week  work
context : i like trips to the ocean. @ path_tailentity : hospital,trip  sometimes take  ill patient  lift i  machine  ocean  lift i staff  hospital
context : i like trips to the ocean. @ path_tailentity : hospital,trip ill patient  ocean  lift i staff  ocd  sometimes take  hospital
context : i like trips to the ocean. @ path_tailentity : hospital,trip  go beach  relax  look job  hospital
context : i like trips to the ocean. @ path_tailentity : hospital,trip  go beach  relax  job  look  hospital
context : i like trips to the ocean. @ path_tailentity : hospital,ocean  go beach  relax  look  job  hospital
context : i like trips to the ocean. @ path_tailentity : hospital,ocean  go beach  relax  look job  hospital
context : i like trips to the ocean. @ path_tailentity : hospital,ocean  ocean  relax  look  job  hospital
context : i like trips to the ocean. @ path_tailentity : work,trip  go beach  relax  look  job  work
context : i like trips to the ocean. @ path_tailentity : hospital,trip  good thing  hard work  open place  ocean  hospital
context : i like trips to the ocean. @ path_tailentity : hospital,ocean  good thing  hard work  open place  hospital
context : i like trips to the ocean. @ path_tailentity : work,trip ocean  good thing  hard work  open place  work
context : i like trips to the ocean. @ path_tailentity : hospital,trip  see ocean  afford  hospital
context : i like trips to the ocean. @ path_tailentity : hospital,ocean  see ocean  afford hospital
context : i like trips to the ocean. @ path_tailentity : work,trip  see ocean  afford  work
context : i like trips to the ocean. @ path_tailentity : hospital,trip  sure use  vacation  hospital
context : i like trips to the ocean. @ path_tailentity : hospital,ocean  vacation  sure use  hospital
context : i like trips to the ocean. @ path_tailentity : work,trip  sure use  vacation  work
context : i spend a lot of time outside. @ path_tailentity : environment,spend lot clean person  walk nature  environment
context : i spend a lot of time outside. @ path_tailentity : environment,spend time  walk nature  clean person environment
context : i spend a lot of time outside. @ path_tailentity : environment,spend  walk nature  clean person environment
context : i spend a lot of time outside. @ path_tailentity : environment,spend lot  love nature  outdoors  preserve  want  environment
context : i spend a lot of time outside. @ path_tailentity : environment,spend lot  love nature  outdoors  preserve  want _ environment
context : i spend a lot of time outside. @ path_tailentity : environment,spend lot  love nature  outdoors  preserve  outdoors  environment
context : i spend a lot of time outside. @ path_tailentity : environment,spend time  want  love nature  outdoors  preserve  environment
context : i spend a lot of time outside. @ path_tailentity : environment,spend  want  love nature  outdoors  preserve  environment
context : i used to be in the army and i did some fighting. @ path_tailentity : curate art,fight  change  profession  curate art
context : i used to be in the army and i did some fighting. @ path_tailentity : curate art,fight change  profession  curate art
context : i used to be in the army and i did some fighting. @ path_tailentity : curate,fight  profession  change  curate
context : i used to be in the army and i did some fighting. @ path_tailentity : curate,fight  profession  change  curate
context : i used to be in the army and i did some fighting. @ path_tailentity : curate,fight  profession  change  curly
context : i used to be in the army and i did some fighting. @ path_tailentity : curate art,use army  change  profession  curate art
context : i used to be in the army and i did some fighting. @ path_tailentity : curate art,fight war  violence ca prefer peace  peace  thing  hippie way  precise art
context : i used to be in the army and i did some fighting. @ path_tailentity : curate,fight  war  thing  violence  war  hippie way  prefer love precise
context : i used to be in the army and i did some fighting. @ path_tailentity : curate,fight  war  thing  hippie way  prefer peace  fight  violence  precise
context : i used to be in the army and i did some fighting. @ path_tailentity : curate,fight war  violence  hippie way  prefer peace  fight  love  precise
context : i used to be in the army and i did some fighting. @ path_tailentity : curate,fight war  thing  violence  prefer peace  fight war  love  precise
context : i used to be in the army and i did some fighting. @ path_tailentity : curate art,fight  box  draw  martial art  hobby  curate art
context : i used to be in the army and i did some fighting. @ path_tailentity : curate,fight  box  draw  martial art  hobby curate
context : i used to be in the army and i did some fighting. @ path_tailentity : curate,fight  box  draw  martial art  manga  curate
context : i enjoy making other people laugh. @ path_tailentity : be manufacturing,enjoy make  enjoy  work  good laugh  i m bore  be manufacturing
context : i enjoy making other people laugh. @ path_tailentity : manufacturing,enjoy make  enjoy  work  good laugh  i m bore  manufacturing
context : i enjoy making other people laugh. @ path_tailentity : manufacturing,enjoy make  work  appreciate  work  good laugh  i  manufacturing
context : i enjoy making other people laugh. @ path_tailentity : be manufacturing,enjoy  enjoy  good laugh  work  i m bore  appreciate  be manufacturing
context : i enjoy making other people laugh. @ path_tailentity : be manufacturing,enjoy  enjoy  work  good laugh  i m bore  be manufacturing
context : i enjoy making other people laugh. @ path_tailentity : be manufacturing,enjoy  enjoy  good laugh  i m bore  work  be manufacturing
context : i enjoy making other people laugh. @ path_tailentity : be manufacturing,enjoy  enjoy  work  good laugh  i  appreciate  be manufacturing
context : i enjoy making other people laugh. @ path_tailentity : be manufacturing,enjoy  enjoy  good laugh  work  i  appreciate be manufacturing
context : i enjoy making other people laugh. @ path_tailentity : be manufacturing,enjoy make  tell joke  tell lot  work  factory  work  be manufacturing
context : i enjoy making other people laugh. @ path_tailentity : manufacturing,enjoy make  tell joke  work  work  factory  tell lot  manufacturing
context : i enjoy making other people laugh. @ path_tailentity : be manufacturing,enjoy  tell joke  tell lot  work  factory  work  be manufacturing
context : i enjoy making other people laugh. @ path_tailentity : be manufacturing,enjoy make  work  want comedian someday  be manufacturing
context : i enjoy making other people laugh. @ path_tailentity : be manufacturing,enjoy make  work  comedian someday  want  be manufacturing
context : i enjoy making other people laugh. @ path_tailentity : manufacturing,enjoy make  work  comedian someday  want  manufacturing
context : i enjoy making other people laugh. @ path_tailentity : be manufacturing,enjoy  work  want comedian someday  be manufacturing
context : i enjoy making other people laugh. @ path_tailentity : be manufacturing,enjoy  work  want comedian someday  be manufacturing
context : i am in college now and want to be a teacher. @ path_tailentity : graduate,be teacher  school  graduate
context : i am in college now and want to be a teacher. @ path_tailentity : be graduate,want teacher  school  be graduate
context : i am in college now and want to be a teacher. @ path_tailentity : graduate,want teacher school  graduate
context : i am around people all day. @ path_tailentity : soy product,people  work  health food store  soy product
context : i am around people all day. @ path_tailentity : soy,people  work  health food store _product soy
context : i am around people all day. @ path_tailentity : soy,people  work  health food store  soy
context : i am around people all day. @ path_tailentity : soy,people  health food store  work _ soy
context : i am around people all day. @ path_tailentity : soy product,day  work  health food store _product soy product
context : i am around people all day. @ path_tailentity : soy product,day  work  health food store  soy product
context : i am around people all day. @ path_tailentity : soy product,people  eat crap  friend  social convention  bug  tend _ soy product
context : i am around people all day. @ path_tailentity : soy,people  eat crap  friend  bug  social convention  eat crap  be expect _ soy
context : i am around people all day. @ path_tailentity : soy product,day  social convention  friend  pest  eat crap  bug tend  soy product
context : i am around people all day. @ path_tailentity : soy product,people  eat  notice  day  way  soy product
context : i am around people all day. @ path_tailentity : soy product,people  eat  eat  day  notice  soy product
context : i am around people all day. @ path_tailentity : soy,people  eat  notice  way  day  soy
context : i am around people all day. @ path_tailentity : soy,people  eat  day  notice  day  soy
context : i am around people all day. @ path_tailentity : soy product,day  way  eat notice  soy product
context : i am around people all day. @ path_tailentity : soy product,day  way  eat  notice  soy product
context : i love to paint pictures. @ path_tailentity : love meat,paint picture  favorite meat  love meat
context : i love to paint pictures. @ path_tailentity : meat,paint picture  favorite meat  meat
context : i love to paint pictures. @ path_tailentity : meat,paint picture  favorite meat  meat
context : i love to paint pictures. @ path_tailentity : love meat,paint  favorite meat  love meat
context : i love to paint pictures. @ path_tailentity : love meat,paint picture favorite painter  artwork  paint image  paint meat  love meat
context : i love to paint pictures. @ path_tailentity : meat,paint picture favorite painter  artist  paint picture  paint meat  meat
context : i love to paint pictures. @ path_tailentity : love meat,paint  paint picture  paint picture favorite painter  artwork  love meat
context : i love to paint pictures. @ path_tailentity : love meat,paint  paint picture  paint image favorite painter  artwork  love meat
context : i love to paint pictures. @ path_tailentity : love meat,paint favorite painter  artwork  paint picture  paint meat  love meat
context : i love to paint pictures. @ path_tailentity : love meat,paint picture cow  love meat
context : i love to paint pictures. @ path_tailentity : meat,paint picture cow  meat
context : i love to paint pictures. @ path_tailentity : love meat,paint  cow  love meat
context : my parent works to help children. @ path_tailentity : supermarket,parent  mom  work cashier  work  supermarket
context : my parent works to help children. @ path_tailentity : supermarket,help child mom  work cashier  supermarket
context : my parent works to help children. @ path_tailentity : supermarket,help mom  work cashier  supermarket
context : my parent works to help children. @ path_tailentity : supermarket,parent  work next door  job  supermarket
context : my parent works to help children. @ path_tailentity : supermarket,help child job  work next door  supermarket
context : my parent works to help children. @ path_tailentity : supermarket,help  work next door job  supermarket
context : i own a home. @ path_tailentity : swim,home  yard  year  i hop  swim pool  swim
context : i own a home. @ path_tailentity : swim,home  yard  yard  i hop  swim pool  swim
context : i own a home. @ path_tailentity : swim,home  live pool  live home dream  swim
context : i enjoy moving to music. @ path_tailentity : pay quality,enjoy move dancer  love watch  expensive one  pay quality
context : i enjoy moving to music. @ path_tailentity : quality,enjoy move dancer  love watch  expensive one  quality
context : i enjoy moving to music. @ path_tailentity : pay quality,enjoy dancer  love watch  expensive one  pay quality
context : i enjoy moving to music. @ path_tailentity : pay quality,enjoy move  love music  search  pay quality
context : i enjoy moving to music. @ path_tailentity : quality,enjoy move  love music  search  quality
context : i enjoy moving to music. @ path_tailentity : pay quality,enjoy  love music  search  pay quality
context : i enjoy moving to music. @ path_tailentity : pay quality,enjoy  love music  search  pay quality
context : i enjoy moving to music. @ path_tailentity : pay quality,enjoy move  dance  subscribe pay quality
context : i enjoy moving to music. @ path_tailentity : quality,enjoy move  skate  good music service  quality
context : i enjoy moving to music. @ path_tailentity : pay quality,enjoy good music service  subscribe  pay quality
context : i enjoy moving to music. @ path_tailentity : pay quality,enjoy  good music service  subscribe  pay quality
context : i enjoy moving to music. @ path_tailentity : pay quality,enjoy move  dance people  dance  pay quality
context : i enjoy moving to music. @ path_tailentity : pay quality,enjoy move people  dance  dance shoe  pay quality
context : i enjoy moving to music. @ path_tailentity : pay quality,enjoy move  dance  dance shoe _product dance  pay quality
context : i enjoy moving to music. @ path_tailentity : quality,enjoy move  dance people  dance  quality
context : i enjoy moving to music. @ path_tailentity : quality,enjoy move  dance people  dance  quality
context : i enjoy moving to music. @ path_tailentity : quality,enjoy move  dance  dance shoe _product dance  quality
