inputs,target
context : i lost one of my parents a while ago. @ path_tailentity : connect others,parent  know  die  be affected  connect others
context : i lost one of my parents a while ago. @ path_tailentity : connect others,parent  know  die  know  connect others
context : i lost one of my parents a while ago. @ path_tailentity : connect,parent  know  die  know _ connect
context : i lost one of my parents a while ago. @ path_tailentity : connect,parent  know  die  be affected  connect
context : i lost one of my parents a while ago. @ path_tailentity : connect,parent  know  die  know  connect
context : i lost one of my parents a while ago. @ path_tailentity : connect others,lose  person  know  die  connect others
context : i am a woman. @ path_tailentity : several child,woman  am mother  am mother  several child
context : i am a woman. @ path_tailentity : child,woman  am mother  am mother  child
context : i am a woman. @ path_tailentity : several,woman  am mother  am mother  several
context : i am a woman. @ path_tailentity : several child,woman  have child  several child
context : i am a woman. @ path_tailentity : child,woman  have child  child
context : i am a woman. @ path_tailentity : several,woman  have child  several
context : i enjoy sitting in front of the tv. @ path_tailentity : have kid,sit tv  watch tv  have kid
context : i enjoy sitting in front of the tv. @ path_tailentity : kid,sit tv  watch tv kid
context : i enjoy sitting in front of the tv. @ path_tailentity : have kid,sit tv  watch  kid tv show  have kid
context : i enjoy sitting in front of the tv. @ path_tailentity : kid,sit tv  watch  kid tv show kid
context : i enjoy sitting in front of the tv. @ path_tailentity : have kid,tv  watch  kid tv show  have kid
context : i enjoy sitting in front of the tv. @ path_tailentity : have kid,sit tv  relax watch  not tend  have kid
context : i enjoy sitting in front of the tv. @ path_tailentity : kid,sit tv  relax watch not tend kid
context : i enjoy sitting in front of the tv. @ path_tailentity : have kid,tv  relax watch  not tend  have kid
context : i love my pets. @ path_tailentity : educator,love pet dog trainer  work  educator
context : i love my pets. @ path_tailentity : educator,pet dog trainer  work  educator
context : i love my pets. @ path_tailentity : educator,love  work  dog trainer  educator
context : i love my pets. @ path_tailentity : educator,love  dog trainer  work educator
context : i love my pets. @ path_tailentity : educator,love pet  have pet  classroom  teacher  educator
context : i love my pets. @ path_tailentity : educator,pet  have pet  classroom  teacher  educator
context : i love my pets. @ path_tailentity : educator,pet  have pet  teach  classroom  educator
context : i love my pets. @ path_tailentity : educator,love  have pet  classroom  teacher  educator
context : i love my pets. @ path_tailentity : educator,love pet student  pet groomer  use  educator
context : i love my pets. @ path_tailentity : educator,pet pet groomer  use  student _occupation educator
context : i love my pets. @ path_tailentity : educator,pet pet groomer  use  student  educator
context : i love my pets. @ path_tailentity : educator,love  love else  pet groomer  student educator
context : i love my pets. @ path_tailentity : educator,love  pet groomer  use student  educator
context : i love my pets. @ path_tailentity : educator,love  love another  pet groomer  student educator
context : lately i have been learning how to garden. @ path_tailentity : musician,be learn  past  time  have lot  musician
context : lately i have been learning how to garden. @ path_tailentity : musician,learn  have lot time  past  musician
context : lately i have been learning how to garden. @ path_tailentity : musician,garden  past  time  have lot  musician
context : lately i have been learning how to garden. @ path_tailentity : musician,garden  time  past  time  musician
context : lately i have been learning how to garden. @ path_tailentity : musician,be learn  play piano  love  garden  musician
context : lately i have been learning how to garden. @ path_tailentity : musician,be learn  play piano  love  garden  musician
context : lately i have been learning how to garden. @ path_tailentity : musician,learn  play piano  love  musician
context : lately i have been learning how to garden. @ path_tailentity : musician,garden  love  play piano musician
context : lately i have been learning how to garden. @ path_tailentity : musician,be learn  wish person  day job  gardening  time  i  musician
context : lately i have been learning how to garden. @ path_tailentity : musician,be learn  wish person  day job  gardening  time  i  m  musician
context : lately i have been learning how to garden. @ path_tailentity : musician,be learn  day job  gardening  time  wish person  day job  musician
context : lately i have been learning how to garden. @ path_tailentity : musician,learn wish person  time  i  m  musician
context : lately i have been learning how to garden. @ path_tailentity : musician,garden  gardening  i  m  wish person time  musician
context : i ride in a sporty vehicle. @ path_tailentity : oil rig,sporty vehicle  car  mechanic  work  oil rig
context : i ride in a sporty vehicle. @ path_tailentity : oil rig,sporty vehicle  car _product mechanic  work  oil rig
context : i ride in a sporty vehicle. @ path_tailentity : rig,sporty vehicle  car  mechanic  work  rig
context : i ride in a sporty vehicle. @ path_tailentity : oil rig,sporty  car  mechanic  work  oil rig
context : i ride in a sporty vehicle. @ path_tailentity : oil rig,sporty vehicle  machinery fascinate  oil rig
context : i ride in a sporty vehicle. @ path_tailentity : rig,sporty vehicle  machinery fascinate  rig
context : i ride in a sporty vehicle. @ path_tailentity : oil rig,sporty  machinery fascinate  oil rig
context : i ride in a sporty vehicle. @ path_tailentity : oil rig,sporty vehicle  drive  like  idea  drive  own sport car oil rig
context : i ride in a sporty vehicle. @ path_tailentity : oil rig,sporty vehicle  drive  like idea  money  own sport car oil rig
context : i ride in a sporty vehicle. @ path_tailentity : oil rig,sporty vehicle  drive  like idea  own sport car  money  oil rig
context : i ride in a sporty vehicle. @ path_tailentity : rig,sporty vehicle  drive  like like _ money  own sport car rig
context : i ride in a sporty vehicle. @ path_tailentity : rig,sporty vehicle  drive  own sport car  like idea  money  rig
context : i ride in a sporty vehicle. @ path_tailentity : rig,sporty vehicle  drive  own sport car  drive  idea  money  rig
context : i ride in a sporty vehicle. @ path_tailentity : rig,sporty vehicle  drive  like  own sport car  money  own sport car rig
context : i ride in a sporty vehicle. @ path_tailentity : oil rig,sporty  own sport car  drive  like  idea  money  oil rig
context : i ride in a sporty vehicle. @ path_tailentity : oil rig,sporty  drive  own sport car  like idea  money  oil rig
context : i have a lot of kids and pets. @ path_tailentity : diesel,pet  support  large family  gasoline engine  fix diesel  diesel
context : i have a lot of kids and pets. @ path_tailentity : diesel,pet  support  gasoline engine  gas  support  diesel
context : i have a lot of kids and pets. @ path_tailentity : diesel,have kid  support  large family  gasoline engine  fix diesel  diesel
context : i have a lot of kids and pets. @ path_tailentity : diesel,kid  fix diesel gasoline engine  support  large family  diesel
context : i have a lot of kids and pets. @ path_tailentity : diesel,pet mechanic  work  support family  diesel
context : i have a lot of kids and pets. @ path_tailentity : diesel,have kid  work  support family  mechanic  diesel
context : i have a lot of kids and pets. @ path_tailentity : diesel,kid  work  support family  mechanic  diesel
context : i have a lot of kids and pets. @ path_tailentity : diesel,kid  mechanic  work  support family  diesel
context : i have a lot of kids and pets. @ path_tailentity : diesel,pet kid  college  have lot of  work car free time  diesel
context : i have a lot of kids and pets. @ path_tailentity : diesel,have kid  work car college  free time  diesel
context : i have a lot of kids and pets. @ path_tailentity : diesel,have kid  work car  free time  college  diesel
context : i have a lot of kids and pets. @ path_tailentity : diesel,kid  work car  free time  college  diesel
context : i have a lot of kids and pets. @ path_tailentity : diesel,kid  work car  free time  college  diesel
context : i have a lot of kids and pets. @ path_tailentity : diesel,pet kid  work person  help  work car  gas engine  gas  diesel
context : i have a lot of kids and pets. @ path_tailentity : diesel,pet kid  work person  help  work car  gas engine  diesel
context : i have a lot of kids and pets. @ path_tailentity : diesel,pet  work person  work car  fix diesel  kid  gas engine  diesel
context : i have a lot of kids and pets. @ path_tailentity : diesel,pet  help  work person  work car  drive engine kid  gas engine  diesel
context : i have a lot of kids and pets. @ path_tailentity : diesel,have kid  work car  help  work person  work engine gas engine  diesel
context : i have a lot of kids and pets. @ path_tailentity : diesel,kid  work car  help  work person work engine  gas engine  diesel
context : i live in the state by colorado. @ path_tailentity : spouse,live colorado  colorodo right  firefighting  alot  husband  spouse
context : i live in the state by colorado. @ path_tailentity : spouse,live colorado  colorodo right  firefighter  alot husband  spouse
context : i live in the state by colorado. @ path_tailentity : spouse,colorado  colorodo right  firefighting  alot  husband  spouse
context : i live in the state by colorado. @ path_tailentity : spouse,live state  colorodo right  firefighting  fire  firefighter  alot  spouse
context : i live in the state by colorado. @ path_tailentity : spouse,live colorado  western state  storm  problem  summer  spouse
context : i live in the state by colorado. @ path_tailentity : spouse,colorado  western state  storm  problem  summer  spouse
context : i live in the state by colorado. @ path_tailentity : spouse,colorado  western state  wildfire ca summer  problem  spouse
context : i live in the state by colorado. @ path_tailentity : spouse,live state  western state  storm  problem  summer  spouse
context : i live in the state by colorado. @ path_tailentity : spouse,live state  colorado  fire  spouse
context : my husband and i have 4 daughters and 1 son. @ path_tailentity : hate,have daughter  adopt dog  adopt street family  hate
context : my husband and i have 4 daughters and 1 son. @ path_tailentity : hate,daughter  family  adopt dog  adopt street  hate
context : my husband and i have 4 daughters and 1 son. @ path_tailentity : hate,husband  family  adopt dog  adopt street  hate
context : my husband and i have 4 daughters and 1 son. @ path_tailentity : hate,have daughter  sick puppy  hate
context : my husband and i have 4 daughters and 1 son. @ path_tailentity : hate,daughter  sick puppy  hate
context : my husband and i have 4 daughters and 1 son. @ path_tailentity : hate,daughter  sick puppy  hate
context : my husband and i have 4 daughters and 1 son. @ path_tailentity : hate,husband  sick puppy  hate
context : i think posting pics on facebook of my everyday life is fun. @ path_tailentity : drive,facebook  popular online  internet  i hop upgrade  vehicle someone drive  like people  drive
context : i think posting pics on facebook of my everyday life is fun. @ path_tailentity : large vehicle,facebook product social medium  show pic show pic day  life  new big truck  large vehicle
context : i think posting pics on facebook of my everyday life is fun. @ path_tailentity : large vehicle,facebook  social medium  socialising  show pic show pic life  new big truck  large vehicle
context : i think posting pics on facebook of my everyday life is fun. @ path_tailentity : vehicle,facebook  social medium  socialising  show pic show pic new big truck  day  vehicle
context : i think posting pics on facebook of my everyday life is fun. @ path_tailentity : vehicle,facebook  social medium  show pic  show pic date  life  new big truck  vehicle
context : i think posting pics on facebook of my everyday life is fun. @ path_tailentity : large vehicle,facebook  post picture  car  large vehicle
context : i think posting pics on facebook of my everyday life is fun. @ path_tailentity : vehicle,facebook product car  post picture  vehicle
context : i think posting pics on facebook of my everyday life is fun. @ path_tailentity : drive,facebook product car  post picture  drive
context : i like to go to the park. @ path_tailentity : be stuck,go park  visit park  want  wide path  be stuck
context : i like to go to the park. @ path_tailentity : be stuck,go park  visit park  wanting  wide path  be stuck
context : i like to go to the park. @ path_tailentity : stuck,go park  visit park  want  wide path  stuck
context : i like to go to the park. @ path_tailentity : be stuck,park  wide path  visit park  want  be stuck
context : i like to go to the park. @ path_tailentity : be stuck,go park wish person  i  i m  be stuck
context : i like to go to the park. @ path_tailentity : be stuck,go park we  wish person  wheelchair  be stuck
context : i like to go to the park. @ path_tailentity : be stuck,go park wheelchair  i  wish person  be stuck
context : i like to go to the park. @ path_tailentity : be stuck,go park i  m  wheelchair  wish person  be stuck
context : i like to go to the park. @ path_tailentity : stuck,go park wish person  i  i m  stuck
context : i like to go to the park. @ path_tailentity : be stuck,park  wheelchair  i m  wish person  be stuck
context : i like to go to the park. @ path_tailentity : be stuck,park  wheelchair  i m  wish person  be stuck
context : i like to go to the park. @ path_tailentity : be stuck,park  wheelchair  i  wish person  be stuck
context : i like to go to the park. @ path_tailentity : be stuck,park  wheelchair  i  m  wish person  be stuck
context : i have a passion for politics. @ path_tailentity : candy store,politics  popcorn  candy store
context : i have a passion for politics. @ path_tailentity : candy store,politics  bazaar  candy store
context : i love my girlfriend. @ path_tailentity : dyed,love girlfriend  like  do something  like  pink hair  do something dyed
context : i love my girlfriend. @ path_tailentity : dyed,love girlfriend  like  do something  know person don't want  pink hair  dyed
context : i love my girlfriend. @ path_tailentity : dyed,girlfriend  like  do something  know person  love  pink hair  dyed
context : i enjoy peaceful sitting. @ path_tailentity : avoid eat broccoli,peaceful sit  way  sometimes be  drinking ca go life  avoid eat broccoli
context : i enjoy peaceful sitting. @ path_tailentity : broccoli,peaceful sit  way  go life sometimes be  drinking  broccoli
context : i enjoy peaceful sitting. @ path_tailentity : avoid eat broccoli,peaceful  sometimes be  go life  way  drinking  avoid eat broccoli
context : i enjoy peaceful sitting. @ path_tailentity : avoid eat broccoli,peaceful sit  food  give gas  ruin peace  avoid eat broccoli
context : i enjoy peaceful sitting. @ path_tailentity : broccoli,peaceful sit  food  give gas  ruin peace broccoli
context : i enjoy peaceful sitting. @ path_tailentity : avoid eat broccoli,peaceful  ruin peace food  give gas  avoid eat broccoli
context : i enjoy peaceful sitting. @ path_tailentity : avoid eat broccoli,peaceful sit  sit  reason  prevents  always make  relax  avoid eat broccoli
context : i enjoy peaceful sitting. @ path_tailentity : avoid eat broccoli,peaceful sit  sit  relax  reason  prevents  always make  avoid eat broccoli
context : i enjoy peaceful sitting. @ path_tailentity : broccoli,peaceful sit  sit  relax  reason  prevents  always make  broccoli
context : i enjoy peaceful sitting. @ path_tailentity : broccoli,peaceful sit  sit quietly  relax  reason  prevents  always make  broccoli
context : i enjoy peaceful sitting. @ path_tailentity : avoid eat broccoli,peaceful  always make reason  relax  feel  prevents  avoid eat broccoli
context : i enjoy peaceful sitting. @ path_tailentity : avoid eat broccoli,peaceful  think  reason  prevents always make  relax  avoid eat broccoli
context : i dropped out of college a month ago. @ path_tailentity : basketball,drop college love bird  watch bird  basketball
context : i dropped out of college a month ago. @ path_tailentity : basketball,drop month love bird  watch bird  basketball
context : i dropped out of college a month ago. @ path_tailentity : basketball,drop  love bird  watch bird  basketball
context : i dropped out of college a month ago. @ path_tailentity : basketball,drop college m  basketball scholarship  get  stink  basketball
context : i dropped out of college a month ago. @ path_tailentity : basketball,drop college i  m  just get  basketball scholarship  basketball
context : i dropped out of college a month ago. @ path_tailentity : basketball,drop college m  just get  basketball scholarship  stink  basketball
context : i dropped out of college a month ago. @ path_tailentity : basketball,drop month i  m  basketball scholarship  get  stink  basketball
context : i dropped out of college a month ago. @ path_tailentity : basketball,drop month m  i  just get  basketball scholarship  basketball
context : i dropped out of college a month ago. @ path_tailentity : basketball,drop month i m  just get  basketball scholarship  stink  basketball
context : i dropped out of college a month ago. @ path_tailentity : basketball,drop basketball scholarship  just get  fart  stink  basketball
context : i dropped out of college a month ago. @ path_tailentity : basketball,drop m  i  just get basketball scholarship  basketball
context : i dropped out of college a month ago. @ path_tailentity : basketball,drop  stink basketball scholarship  just get i  i  basketball
context : i dropped out of college a month ago. @ path_tailentity : basketball,drop  get  basketball scholarship  i m  stink basketball
context : i dropped out of college a month ago. @ path_tailentity : basketball,drop month ami  athletic career  do life  probably pursue  i  basketball
context : i dropped out of college a month ago. @ path_tailentity : basketball,drop month probably pursue  am go  athletic career  do life  i  basketball
context : i volunteer at an animal shelter. @ path_tailentity : adult,volunteer  work shelter work shelter sinner  son  adult
context : i volunteer at an animal shelter. @ path_tailentity : adult,volunteer  work shelter work shelter s adult  son  adult
context : i volunteer at an animal shelter. @ path_tailentity : adult,volunteer  have time adult
context : i volunteer at an animal shelter. @ path_tailentity : adult,animal shelter  have time adult
context : i volunteer at an animal shelter. @ path_tailentity : adult,shelter  have time adult
context : i volunteer at an animal shelter. @ path_tailentity : adult,shelter  work  have i  work  have time  mom  always want _ be busy be  adult
context : i volunteer at an animal shelter. @ path_tailentity : adult,shelter mom  work  have i  do kind  have time  work  always want _ adult
context : i am a great cook. @ path_tailentity : have daughter,great cook  met wife  married  work restaurant child  have daughter
context : i am a great cook. @ path_tailentity : daughter,great cook  met wife  work restaurant child  married  daughter
context : i am a great cook. @ path_tailentity : have daughter,cook child  married  met wife  work restaurant  have daughter
context : i am a great cook. @ path_tailentity : have daughter,cook child  married  work restaurant child  have daughter
context : i enjoy skateboarding and going skiing. @ path_tailentity : mutt,skateboard  other hobby  wish person thing  mutt
context : i enjoy skateboarding and going skiing. @ path_tailentity : feline,skateboard  other hobby  wish person thing  feline
context : i enjoy skateboarding and going skiing. @ path_tailentity : hat,skateboard  other hobby  wish person thing  hat
context : i enjoy skateboarding and going skiing. @ path_tailentity : mutt,skateboard dog  mutt
context : i enjoy skateboarding and going skiing. @ path_tailentity : feline,skateboard dog  feline
context : i enjoy skateboarding and going skiing. @ path_tailentity : hat,skateboard dog  hat
context : i am in college now and want to be a teacher. @ path_tailentity : fishing,be teacher really love  taught  fishing
context : i am in college now and want to be a teacher. @ path_tailentity : fishing,want teacher  really love  taught  fishing
context : i am in college now and want to be a teacher. @ path_tailentity : fishing,teacher  taught  really love  fishing
context : i am a ballet dancer. @ path_tailentity : hamburger,ballet dancer  burn hamburger  hamburger
context : i am a ballet dancer. @ path_tailentity : hamburger,ballet  burn hamburger hamburger
context : i am a ballet dancer. @ path_tailentity : hamburger,dancer  burn hamburger  hamburger
context : i have one pet. @ path_tailentity : parent,have pet  travel lot _ many pet  not want  parent
context : i have one pet. @ path_tailentity : parent,have pet  travel lot not want  many pet  parent
context : i have one pet. @ path_tailentity : parent,have pet  many pet  not want  travel lot parent
context : i have one pet. @ path_tailentity : parent,pet  many pet  not want  travel lot parent
context : i have one pet. @ path_tailentity : parent,have pet  exotic pet  call capybara people  interest thing  parent
context : i have one pet. @ path_tailentity : parent,pet  exotic pet  call capybara people  interest thing parent
context : i have one pet. @ path_tailentity : parent,have pet  only pet  brazil  trip parent
context : i have one pet. @ path_tailentity : parent,pet  only pet  brazil  trip parent
context : reality programs with music and liveliness gets my heart racing. @ path_tailentity : scfname,liveliness get  watch  show pet scfname
context : reality programs with music and liveliness gets my heart racing. @ path_tailentity : scfname,liveliness  watch  show pet scfname
context : reality programs with music and liveliness gets my heart racing. @ path_tailentity : scfname,reality program  show pet  watch  scfname
context : reality programs with music and liveliness gets my heart racing. @ path_tailentity : scfname,liveliness get  science fiction program  scfname
context : reality programs with music and liveliness gets my heart racing. @ path_tailentity : scfname,liveliness  science fiction program  scfname
context : reality programs with music and liveliness gets my heart racing. @ path_tailentity : scfname,reality program  science fiction program  scfname
context : i enjoy simple but filling foods. @ path_tailentity : realizes person,fill food  eat  read  realises person
context : i enjoy simple but filling foods. @ path_tailentity : realizes person,fill food  eat  read  realizes person
context : i enjoy simple but filling foods. @ path_tailentity : realizes,fill food  eat  read  realises
context : i enjoy simple but filling foods. @ path_tailentity : realizes,fill food  eat  read  realizes
context : i enjoy simple but filling foods. @ path_tailentity : realizes person,fill  eat  read  realises person
context : i enjoy simple but filling foods. @ path_tailentity : realizes person,fill  eat  read  realizes person
context : i enjoy simple but filling foods. @ path_tailentity : realizes,fill food i  m reading  favorite snack  always eat  always eat  realizes
context : i enjoy simple but filling foods. @ path_tailentity : realizes person,fill simple food  i m reading  always eat  always eat  realizes person
context : i enjoy simple but filling foods. @ path_tailentity : realizes person,fill food  book  much time  think food  not spend  realises person
context : i enjoy simple but filling foods. @ path_tailentity : realizes person,fill food  book  much time  think food  not spend  realizes person
context : i enjoy simple but filling foods. @ path_tailentity : realizes,fill food  book  much time  think food  not spend  realizes
context : i enjoy simple but filling foods. @ path_tailentity : realizes,fill food  book  not spend  think food  much time  realises
context : i enjoy simple but filling foods. @ path_tailentity : realizes person,fill  book  much time  think food  not spend  realises person
context : i enjoy simple but filling foods. @ path_tailentity : realizes person,fill not spend  not spend  book  think food  realizes person
context : i like long walks on the beach. @ path_tailentity : dad,beach  certified beach  certify wedding  use wedding dad
context : i like long walks on the beach. @ path_tailentity : dad,beach  beach  certification  certify wedding dad
context : i like long walks on the beach. @ path_tailentity : preacher,beach  use wedding  certified beach  certify wedding preacher
context : i like long walks on the beach. @ path_tailentity : preacher,beach  certified beach  beach  certify wedding preacher
context : i am a woman. @ path_tailentity : own small marketing consult agency,woman  advertising  work  own small marketing consult agency
context : i am a woman. @ path_tailentity : marketing,woman  work  advertising  marketing
context : i am a woman. @ path_tailentity : agency,woman  advertising  work  agency
context : i am a woman. @ path_tailentity : own small marketing consult agency,woman  own business  know lot  run  own small marketing consult agency
context : i am a woman. @ path_tailentity : marketing,woman  own business  know lot  run  marketing
